24-904;200336;Hospital de día Infanto Adolescente;10;De Los Lagos;10101;Puerto Montt;24;Del Reloncaví;0;Secundario;Secundario;Servicio de Salud;No Autogestionado;NO;No Especialidad;SI;SI;200336
24-330;124330;Centro de Salud Familiar Los Muermos;10;De Los Lagos;10106;Los Muermos;24;Del Reloncaví;Consultorio General Rural;Primario;Primario;Municipal;No Autogestionado;NO;No Especialidad;SI;SI;124330
24-370;124370;Centro de Salud Familiar Los Volcanes;10;De Los Lagos;10107;Llanquihue;24;Del Reloncaví;Consultorio General Urbano;Primario;Primario;Municipal;No Autogestionado;NO;No Especialidad;SI;SI;124370
24-305;124305;Centro de Salud Familiar Angelmó;10;De Los Lagos;10101;Puerto Montt;24;Del Reloncaví;Consultorio General Urbano;Primario;Primario;Municipal;No Autogestionado;NO;No Especialidad;SI;SI;124305
24-310;124310;Centro de Salud Familiar Antonio Varas;10;De Los Lagos;10101;Puerto Montt;24;Del Reloncaví;Consultorio General Urbano;Primario;Primario;Municipal;No Autogestionado;NO;No Especialidad;SI;SI;124310
24-315;124315;Centro de Salud Familiar Carmela Carvajal;10;De Los Lagos;10101;Puerto Montt;24;Del Reloncaví;Consultorio General Urbano;Primario;Primario;Municipal;No Autogestionado;NO;No Especialidad;SI;SI;124315
24-320;124320;Centro de Salud Familiar Techo para todos (ONG);10;De Los Lagos;10101;Puerto Montt;24;Del Reloncaví;Consultorio General Urbano;Primario;Primario;Otra Institución;No Autogestionado;NO;No Especialidad;SI;SI;124320
24-325;124325;Centro de Salud Familiar Carelmapu;10;De Los Lagos;10108;Maullín;24;Del Reloncaví;Consultorio General Rural;Primario;Primario;Municipal;No Autogestionado;NO;No Especialidad;SI;SI;124325
24-335;124335;Centro de Salud Familiar Nº 1 Puerto Varas;10;De Los Lagos;10109;Puerto Varas;24;Del Reloncaví;Consultorio General Urbano;Primario;Primario;Municipal;No Autogestionado;NO;No Especialidad;SI;SI;124335
24-365;124365;Centro de Salud Familiar Frutillar Alto;10;De Los Lagos;10105;Frutillar;24;Del Reloncaví;Consultorio General Urbano;Primario;Primario;Municipal;No Autogestionado;NO;No Especialidad;SI;SI;124365
24-380;124380;Centro de Salud Familiar Río Negro Hornopirén;10;De Los Lagos;10403;Hualaihué;24;Del Reloncaví;Consultorio General Urbano;Primario;Primario;Servicio de Salud;No Autogestionado;NO;No Especialidad;SI;SI;124380
24-381;124381;Centro de Salud Familiar Padre Hurtado;10;De Los Lagos;10101;Puerto Montt;24;Del Reloncaví;Consultorio General Urbano;Primario;Primario;Municipal;No Autogestionado;NO;No Especialidad;SI;SI;124381
24-385;124385;Centro de Salud Familiar San Pablo Mirasol (ONG);10;De Los Lagos;10101;Puerto Montt;24;Del Reloncaví;Consultorio General Urbano;Primario;Primario;Otra Institución;No Autogestionado;NO;No Especialidad;SI;SI;124385
24-395;124395;Centro de Salud Familiar Alerce;10;De Los Lagos;10101;Puerto Montt;24;Del Reloncaví;Consultorio General Urbano;Primario;Primario;Municipal;No Autogestionado;NO;No Especialidad;SI;SI;124395
24-396;124396;Centro de Salud Familiar Calbuco;10;De Los Lagos;10102;Calbuco;24;Del Reloncaví;Consultorio General Rural;Primario;Primario;Municipal;No Autogestionado;NO;No Especialidad;SI;SI;124396
24-601;124601;COSAM Puerto Montt;10;De Los Lagos;10101;Puerto Montt;24;Del Reloncaví;0;Secundario;Secundario;Servicio de Salud;No Autogestionado;NO;No Especialidad;SI;SI;124601
24-602;124602;COSAM de Reloncaví;10;De Los Lagos;10101;Puerto Montt;24;Del Reloncaví;0;Secundario;Secundario;Servicio de Salud;No Autogestionado;NO;No Especialidad;SI;SI;124602
24-010;124010;Actividades gestionadas por la Dirección del Servicio para apoyo de la Red (S.S Del Reloncaví);10;De Los Lagos;10101;Puerto Montt;24;Del Reloncaví;Dirección Servicio de Salud;No Aplica;No Aplica;Servicio de Salud;No Autogestionado;NO;No Especialidad;SI;SI;124010
24-105;124105;Hospital de Puerto Montt;10;De Los Lagos;10101;Puerto Montt;24;Del Reloncaví;Establecimiento Alta Complejidad;Secundario;Terciario;Servicio de Salud;No Autogestionado;SI;No Especialidad;SI;SI;124105
24-110;124110;Hospital de Llanquihue;10;De Los Lagos;10107;Llanquihue;24;Del Reloncaví;Establecimiento Baja Complejidad;Primario;Terciario;Servicio de Salud;No Autogestionado;SI;No Especialidad;SI;SI;124110
24-115;124115;Hospital de Frutillar;10;De Los Lagos;10105;Frutillar;24;Del Reloncaví;Establecimiento Baja Complejidad;Primario;Terciario;Servicio de Salud;No Autogestionado;SI;No Especialidad;SI;SI;124115
24-120;124120;Hospital de Fresia;10;De Los Lagos;10104;Fresia;24;Del Reloncaví;Establecimiento Baja Complejidad;Primario;Terciario;Servicio de Salud;No Autogestionado;SI;No Especialidad;SI;SI;124120
24-125;124125;Hospital de Maullín;10;De Los Lagos;10108;Maullín;24;Del Reloncaví;Establecimiento Baja Complejidad;Primario;Terciario;Servicio de Salud;No Autogestionado;SI;No Especialidad;SI;SI;124125
24-130;124130;Hospital de Calbuco;10;De Los Lagos;10102;Calbuco;24;Del Reloncaví;Establecimiento Baja Complejidad;Primario;Terciario;Servicio de Salud;No Autogestionado;SI;No Especialidad;SI;SI;124130
24-140;124140;Hospital de Palena;10;De Los Lagos;10404;Palena;24;Del Reloncaví;Establecimiento Baja Complejidad;Primario;Terciario;Servicio de Salud;No Autogestionado;SI;No Especialidad;SI;SI;124140
24-145;124145;Hospital de Futaleufú;10;De Los Lagos;10402;Futaleufú;24;Del Reloncaví;Establecimiento Baja Complejidad;Primario;Terciario;Servicio de Salud;No Autogestionado;SI;No Especialidad;SI;SI;124145
24-976;200076;Hospital de Chaitén;10;De Los Lagos;10401;Chaitén;24;Del Reloncaví;Establecimiento Baja Complejidad;Primario;Terciario;Servicio de Salud;No Autogestionado;SI;No Especialidad;SI;SI;200076
24-210;124210;Clínica de Puerto Varas SpA.;10;De Los Lagos;10109;Puerto Varas;10;M. Occidente;Clínica;Secundario;No Aplica;Privado;No Autogestionado;SI;No Especialidad;SI;SI;124210
24-401;124401;Posta de Salud Rural Lago Chapo;10;De Los Lagos;10101;Puerto Montt;24;Del Reloncaví;Posta de Salud Rural;Primario;Primario;Municipal;No Autogestionado;NO;No Especialidad;SI;SI;124401
24-402;124402;Posta de Salud Rural Correntoso;10;De Los Lagos;10101;Puerto Montt;24;Del Reloncaví;Posta de Salud Rural;Primario;Primario;Municipal;No Autogestionado;NO;No Especialidad;SI;SI;124402
24-403;124403;Posta de Salud Rural Chaicas;10;De Los Lagos;10101;Puerto Montt;24;Del Reloncaví;Posta de Salud Rural;Primario;Primario;Municipal;No Autogestionado;NO;No Especialidad;SI;SI;124403
24-404;124404;Posta de Salud Rural Lenca;10;De Los Lagos;10101;Puerto Montt;24;Del Reloncaví;Posta de Salud Rural;Primario;Primario;Municipal;No Autogestionado;NO;No Especialidad;SI;SI;124404
24-405;124405;Posta de Salud Rural Las Quemas (Puerto Montt);10;De Los Lagos;10101;Puerto Montt;24;Del Reloncaví;Posta de Salud Rural;Primario;Primario;Municipal;No Autogestionado;NO;No Especialidad;SI;SI;124405
24-406;124406;Posta de Salud Rural Maillén;10;De Los Lagos;10101;Puerto Montt;24;Del Reloncaví;Posta de Salud Rural;Primario;Primario;Municipal;No Autogestionado;NO;No Especialidad;SI;SI;124406
24-407;124407;Posta de Salud Rural Salto Grande;10;De Los Lagos;10101;Puerto Montt;24;Del Reloncaví;Posta de Salud Rural;Primario;Primario;Municipal;No Autogestionado;NO;No Especialidad;SI;SI;124407
24-408;124408;Posta de Salud Rural Salto Chico;10;De Los Lagos;10101;Puerto Montt;24;Del Reloncaví;Posta de Salud Rural;Primario;Primario;Municipal;No Autogestionado;NO;No Especialidad;SI;SI;124408
24-409;124409;Posta de Salud Rural Trapén;10;De Los Lagos;10101;Puerto Montt;24;Del Reloncaví;Posta de Salud Rural;Primario;Primario;Municipal;No Autogestionado;NO;No Especialidad;SI;SI;124409
24-410;124410;Posta de Salud Rural Panitao;10;De Los Lagos;10101;Puerto Montt;24;Del Reloncaví;Posta de Salud Rural;Primario;Primario;Municipal;No Autogestionado;NO;No Especialidad;SI;SI;124410
24-411;124411;Posta de Salud Rural Cochamó;10;De Los Lagos;10103;Cochamó;24;Del Reloncaví;Posta de Salud Rural;Primario;Primario;Municipal;No Autogestionado;NO;No Especialidad;SI;SI;124411
24-412;124412;Centro de Salud Familiar Cochamó;10;De Los Lagos;10103;Cochamó;24;Del Reloncaví;Consultorio General Rural;Primario;Primario;Municipal;No Autogestionado;NO;No Especialidad;SI;SI;124412
24-413;124413;Posta de Salud Rural Sotomó;10;De Los Lagos;10103;Cochamó;24;Del Reloncaví;Posta de Salud Rural;Primario;Primario;Municipal;No Autogestionado;NO;No Especialidad;SI;SI;124413
24-414;124414;Posta de Salud Rural Llanada Grande;10;De Los Lagos;10103;Cochamó;24;Del Reloncaví;Posta de Salud Rural;Primario;Primario;Municipal;No Autogestionado;NO;No Especialidad;SI;SI;124414
24-415;124415;Posta de Salud Rural Paso El Bolsón o Segundo Corral;10;De Los Lagos;10103;Cochamó;24;Del Reloncaví;Posta de Salud Rural;Primario;Primario;Municipal;No Autogestionado;NO;No Especialidad;SI;SI;124415
24-416;124416;Posta de Salud Rural Paso El León;10;De Los Lagos;10103;Cochamó;24;Del Reloncaví;Posta de Salud Rural;Primario;Primario;Municipal;No Autogestionado;NO;No Especialidad;SI;SI;124416
24-417;124417;Posta de Salud Rural Aulén;10;De Los Lagos;10403;Hualaihué;24;Del Reloncaví;Posta de Salud Rural;Primario;Primario;Servicio de Salud;No Autogestionado;NO;No Especialidad;SI;SI;124417
24-418;124418;Posta de Salud Rural Rolecha;10;De Los Lagos;10403;Hualaihué;24;Del Reloncaví;Posta de Salud Rural;Primario;Primario;Servicio de Salud;No Autogestionado;NO;No Especialidad;SI;SI;124418
24-419;124419;Posta de Salud Rural Contao;10;De Los Lagos;10403;Hualaihué;24;Del Reloncaví;Posta de Salud Rural;Primario;Primario;Servicio de Salud;No Autogestionado;NO;No Especialidad;SI;SI;124419
24-420;124420;Centro Comunitario de Salud Familiar Hualaihué;10;De Los Lagos;10403;Hualaihué;24;Del Reloncaví;0;Primario;Primario;Servicio de Salud;No Autogestionado;NO;No Especialidad;SI;SI;124420
24-421;124421;Posta de Salud Rural Ensenada;10;De Los Lagos;10109;Puerto Varas;24;Del Reloncaví;Posta de Salud Rural;Primario;Primario;Municipal;No Autogestionado;NO;No Especialidad;SI;SI;124421
24-422;124422;Posta de Salud Rural Peulla;10;De Los Lagos;10109;Puerto Varas;24;Del Reloncaví;Posta de Salud Rural;Primario;Primario;Municipal;No Autogestionado;NO;No Especialidad;SI;SI;124422
24-423;124423;Posta de Salud Rural Nueva Braunau;10;De Los Lagos;10109;Puerto Varas;24;Del Reloncaví;Posta de Salud Rural;Primario;Primario;Municipal;No Autogestionado;NO;No Especialidad;SI;SI;124423
24-424;124424;Posta de Salud Rural Petrohué;10;De Los Lagos;10109;Puerto Varas;24;Del Reloncaví;Posta de Salud Rural;Primario;Primario;Municipal;No Autogestionado;NO;No Especialidad;SI;SI;124424
24-425;124425;Posta de Salud Rural Colonia Río Sur;10;De Los Lagos;10109;Puerto Varas;24;Del Reloncaví;Posta de Salud Rural;Primario;Primario;Municipal;No Autogestionado;NO;No Especialidad;SI;SI;124425
24-426;124426;Posta de Salud Rural Ralún;10;De Los Lagos;10109;Puerto Varas;24;Del Reloncaví;Posta de Salud Rural;Primario;Primario;Municipal;No Autogestionado;NO;No Especialidad;SI;SI;124426
24-427;124427;Posta de Salud Rural Loncotoro;10;De Los Lagos;10107;Llanquihue;24;Del Reloncaví;Posta de Salud Rural;Primario;Primario;Municipal;No Autogestionado;NO;No Especialidad;NO;SI;124427
24-428;124428;Posta de Salud Rural Pellines (Llanquihue);10;De Los Lagos;10107;Llanquihue;24;Del Reloncaví;Posta de Salud Rural;Primario;Primario;Municipal;No Autogestionado;NO;No Especialidad;SI;SI;124428
24-429;124429;Posta de Salud Rural Colegual;10;De Los Lagos;10107;Llanquihue;24;Del Reloncaví;Posta de Salud Rural;Primario;Primario;Municipal;No Autogestionado;NO;No Especialidad;SI;SI;124429
24-430;124430;Posta de Salud Rural Casma;10;De Los Lagos;10105;Frutillar;24;Del Reloncaví;Posta de Salud Rural;Primario;Primario;Municipal;No Autogestionado;NO;No Especialidad;SI;SI;124430
24-432;124432;Posta de Salud Rural Centinela;10;De Los Lagos;10105;Frutillar;24;Del Reloncaví;Posta de Salud Rural;Primario;Primario;Municipal;No Autogestionado;NO;No Especialidad;SI;SI;124432
24-433;124433;Posta de Salud Rural Parga;10;De Los Lagos;10104;Fresia;24;Del Reloncaví;Posta de Salud Rural;Primario;Primario;Municipal;No Autogestionado;NO;No Especialidad;SI;SI;124433
24-434;124434;Posta de Salud Rural Tegualda;10;De Los Lagos;10104;Fresia;24;Del Reloncaví;Posta de Salud Rural;Primario;Primario;Municipal;No Autogestionado;NO;No Especialidad;SI;SI;124434
24-435;124435;Posta de Salud Rural Polizones;10;De Los Lagos;10104;Fresia;24;Del Reloncaví;Posta de Salud Rural;Primario;Primario;Municipal;No Autogestionado;NO;No Especialidad;SI;SI;124435
24-436;124436;Posta de Salud Rural Cau Cua;10;De Los Lagos;10104;Fresia;24;Del Reloncaví;Posta de Salud Rural;Primario;Primario;Municipal;No Autogestionado;NO;No Especialidad;SI;SI;124436
24-437;124437;Posta de Salud Rural Mañío;10;De Los Lagos;10104;Fresia;24;Del Reloncaví;Posta de Salud Rural;Primario;Primario;Municipal;No Autogestionado;NO;No Especialidad;SI;SI;124437
24-438;124438;Posta de Salud Rural El Mirador;10;De Los Lagos;10104;Fresia;24;Del Reloncaví;Posta de Salud Rural;Primario;Primario;Municipal;No Autogestionado;NO;No Especialidad;SI;SI;124438
24-439;124439;Posta de Salud Rural Traiguén (Fresia);10;De Los Lagos;10104;Fresia;24;Del Reloncaví;Posta de Salud Rural;Primario;Primario;Municipal;No Autogestionado;NO;No Especialidad;SI;SI;124439
24-440;124440;Posta de Salud Rural Las Cruces ( Fresia);10;De Los Lagos;10104;Fresia;24;Del Reloncaví;Posta de Salud Rural;Primario;Primario;Municipal;No Autogestionado;NO;No Especialidad;SI;SI;124440
24-441;124441;Posta de Salud Rural Línea Sin Nombre;10;De Los Lagos;10104;Fresia;24;Del Reloncaví;Posta de Salud Rural;Primario;Primario;Municipal;No Autogestionado;NO;No Especialidad;SI;SI;124441
24-442;124442;Posta de Salud Rural Carelmapu;10;De Los Lagos;10108;Maullín;24;Del Reloncaví;Posta de Salud Rural;Primario;Primario;Municipal;No Autogestionado;NO;No Especialidad;SI;SI;124442
24-443;124443;Posta de Salud Rural Misquihue;10;De Los Lagos;10108;Maullín;24;Del Reloncaví;Posta de Salud Rural;Primario;Primario;Municipal;No Autogestionado;NO;No Especialidad;SI;SI;124443
24-444;124444;Posta de Salud Rural Peñol;10;De Los Lagos;10108;Maullín;24;Del Reloncaví;Posta de Salud Rural;Primario;Primario;Municipal;No Autogestionado;NO;No Especialidad;SI;SI;124444
24-445;124445;Posta de Salud Rural Astillero;10;De Los Lagos;10108;Maullín;24;Del Reloncaví;Posta de Salud Rural;Primario;Primario;Municipal;No Autogestionado;NO;No Especialidad;SI;SI;124445
24-446;124446;Posta de Salud Rural La Pasada;10;De Los Lagos;10108;Maullín;24;Del Reloncaví;Posta de Salud Rural;Primario;Primario;Municipal;No Autogestionado;NO;No Especialidad;SI;SI;124446
24-447;124447;Posta de Salud Rural Quenuir;10;De Los Lagos;10108;Maullín;24;Del Reloncaví;Posta de Salud Rural;Primario;Primario;Municipal;No Autogestionado;NO;No Especialidad;SI;SI;124447
24-448;124448;Posta de Salud Rural Pargua;10;De Los Lagos;10102;Calbuco;24;Del Reloncaví;Posta de Salud Rural;Primario;Primario;Municipal;No Autogestionado;NO;No Especialidad;SI;SI;124448
24-449;124449;Posta de Salud Rural Putenio;10;De Los Lagos;10102;Calbuco;24;Del Reloncaví;Posta de Salud Rural;Primario;Primario;Municipal;No Autogestionado;NO;No Especialidad;SI;SI;124449
24-450;124450;Centro Comunitario de Salud Familiar Texas;10;De Los Lagos;10102;Calbuco;24;Del Reloncaví;0;Primario;Primario;Municipal;No Autogestionado;NO;No Especialidad;SI;SI;124450
24-451;124451;Posta de Salud Rural Aguantao;10;De Los Lagos;10102;Calbuco;24;Del Reloncaví;Posta de Salud Rural;Primario;Primario;Municipal;No Autogestionado;NO;No Especialidad;SI;SI;124451
24-452;124452;Posta de Salud Rural Peñasmo;10;De Los Lagos;10102;Calbuco;24;Del Reloncaví;Posta de Salud Rural;Primario;Primario;Municipal;No Autogestionado;NO;No Especialidad;SI;SI;124452
24-453;124453;Posta de Salud Rural Avellanal;10;De Los Lagos;10102;Calbuco;24;Del Reloncaví;Posta de Salud Rural;Primario;Primario;Municipal;No Autogestionado;NO;No Especialidad;SI;SI;124453
24-454;124454;Posta de Salud Rural Tabón;10;De Los Lagos;10102;Calbuco;24;Del Reloncaví;Posta de Salud Rural;Primario;Primario;Municipal;No Autogestionado;NO;No Especialidad;SI;SI;124454
24-455;124455;Posta de Salud Rural Huar;10;De Los Lagos;10102;Calbuco;24;Del Reloncaví;Posta de Salud Rural;Primario;Primario;Municipal;No Autogestionado;NO;No Especialidad;SI;SI;124455
24-456;124456;Posta de Salud Rural Chauquear;10;De Los Lagos;10102;Calbuco;24;Del Reloncaví;Posta de Salud Rural;Primario;Primario;Municipal;No Autogestionado;NO;No Especialidad;SI;SI;124456
24-457;124457;Posta de Salud Rural Chayahue;10;De Los Lagos;10102;Calbuco;24;Del Reloncaví;Posta de Salud Rural;Primario;Primario;Municipal;No Autogestionado;NO;No Especialidad;SI;SI;124457
24-458;124458;Posta de Salud Rural Pergue;10;De Los Lagos;10102;Calbuco;24;Del Reloncaví;Posta de Salud Rural;Primario;Primario;Municipal;No Autogestionado;NO;No Especialidad;SI;SI;124458
24-459;124459;Posta de Salud Rural Quetrulauquén;10;De Los Lagos;10102;Calbuco;24;Del Reloncaví;Posta de Salud Rural;Primario;Primario;Municipal;No Autogestionado;NO;No Especialidad;SI;SI;124459
24-460;124460;Posta de Salud Rural San Antonio (Calbuco);10;De Los Lagos;10102;Calbuco;24;Del Reloncaví;Posta de Salud Rural;Primario;Primario;Municipal;No Autogestionado;NO;No Especialidad;SI;SI;124460
24-461;124461;Posta de Salud Rural San Agustín (Calbuco);10;De Los Lagos;10102;Calbuco;24;Del Reloncaví;Posta de Salud Rural;Primario;Primario;Municipal;No Autogestionado;NO;No Especialidad;SI;SI;124461
24-462;124462;Posta de Salud Rural Cañitas;10;De Los Lagos;10106;Los Muermos;24;Del Reloncaví;Posta de Salud Rural;Primario;Primario;Municipal;No Autogestionado;NO;No Especialidad;SI;SI;124462
24-463;124463;Posta de Salud Rural Los Piques;10;De Los Lagos;10106;Los Muermos;24;Del Reloncaví;Posta de Salud Rural;Primario;Primario;Municipal;No Autogestionado;NO;No Especialidad;SI;SI;124463
24-464;124464;Posta de Salud Rural Cumbre Alta;10;De Los Lagos;10106;Los Muermos;24;Del Reloncaví;Posta de Salud Rural;Primario;Primario;Municipal;No Autogestionado;NO;No Especialidad;SI;SI;124464
24-465;124465;Posta de Salud Rural Quillagua (Los Muermos);10;De Los Lagos;10106;Los Muermos;24;Del Reloncaví;Posta de Salud Rural;Primario;Primario;Municipal;No Autogestionado;NO;No Especialidad;SI;SI;124465
24-518;124518;Posta de Salud Rural Chulín;10;De Los Lagos;10401;Chaitén;24;Del Reloncaví;Posta de Salud Rural;Primario;Primario;Municipal;No Autogestionado;NO;No Especialidad;SI;SI;124518
24-519;124519;Posta de Salud Rural Buill;10;De Los Lagos;10401;Chaitén;24;Del Reloncaví;Posta de Salud Rural;Primario;Primario;Municipal;Autogestionado;NO;Atención de Especialidad;SI;SI;124519
24-520;124520;Posta de Salud Rural Talcán;10;De Los Lagos;10401;Chaitén;24;Del Reloncaví;Posta de Salud Rural;Primario;Primario;Municipal;Autogestionado;NO;Atención de Especialidad;SI;SI;124520
24-521;124521;Posta de Salud Rural Nayahue;10;De Los Lagos;10401;Chaitén;24;Del Reloncaví;Posta de Salud Rural;Primario;Primario;Municipal;No Autogestionado;NO;No Especialidad;SI;SI;124521
24-530;124530;Posta de Salud Rural Chumeldén;10;De Los Lagos;10401;Chaitén;24;Del Reloncaví;Posta de Salud Rural;Primario;Primario;Municipal;No Autogestionado;NO;No Especialidad;SI;SI;124530
24-531;124531;Posta de Salud Rural Ayacara;10;De Los Lagos;10401;Chaitén;24;Del Reloncaví;Posta de Salud Rural;Primario;Primario;Municipal;No Autogestionado;NO;No Especialidad;SI;SI;124531
24-532;124532;Posta de Salud Rural El Frío o Santa Lucía;10;De Los Lagos;10401;Chaitén;24;Del Reloncaví;Posta de Salud Rural;Primario;Primario;Municipal;No Autogestionado;NO;No Especialidad;SI;SI;124532
24-533;124533;Posta de Salud Rural Chana;10;De Los Lagos;10401;Chaitén;24;Del Reloncaví;Posta de Salud Rural;Primario;Primario;Municipal;No Autogestionado;NO;No Especialidad;SI;SI;124533
24-534;124534;Posta de Salud Rural Puerto Ramírez;10;De Los Lagos;10404;Palena;24;Del Reloncaví;Posta de Salud Rural;Primario;Primario;Municipal;No Autogestionado;NO;No Especialidad;SI;SI;124534
24-535;124535;Posta de Salud Rural El Azul;10;De Los Lagos;10402;Futaleufú;24;Del Reloncaví;Posta de Salud Rural;Primario;Primario;Municipal;No Autogestionado;NO;No Especialidad;SI;SI;124535
24-536;124536;Posta de Salud Rural El Malito;10;De Los Lagos;10404;Palena;24;Del Reloncaví;Posta de Salud Rural;Primario;Primario;Municipal;No Autogestionado;NO;No Especialidad;SI;SI;124536
24-537;124537;Posta de Salud Rural Chope;10;De Los Lagos;10102;Calbuco;24;Del Reloncaví;Posta de Salud Rural;Primario;Primario;Municipal;No Autogestionado;NO;No Especialidad;SI;SI;124537
24-539;124539;Posta de Salud Rural Pocoihuén;10;De Los Lagos;10103;Cochamó;24;Del Reloncaví;Posta de Salud Rural;Primario;Primario;Municipal;No Autogestionado;NO;No Especialidad;SI;SI;124539
24-540;124540;Posta de Salud Rural El Espolón;10;De Los Lagos;10402;Futaleufú;24;Del Reloncaví;Posta de Salud Rural;Primario;Primario;Municipal;No Autogestionado;NO;No Especialidad;SI;SI;124540
24-541;124541;Posta de Salud Rural Huelmo;10;De Los Lagos;10101;Puerto Montt;24;Del Reloncaví;Posta de Salud Rural;Primario;Primario;Municipal;No Autogestionado;NO;No Especialidad;SI;SI;124541
24-543;124543;Posta de Salud Rural Valle El Frío;10;De Los Lagos;10103;Cochamó;24;Del Reloncaví;Posta de Salud Rural;Primario;Primario;Municipal;No Autogestionado;NO;No Especialidad;SI;SI;124543
24-544;124544;Posta de Salud Rural Piedra Azul;10;De Los Lagos;10101;Puerto Montt;24;Del Reloncaví;Posta de Salud Rural;Primario;Primario;Municipal;No Autogestionado;NO;No Especialidad;SI;SI;124544
24-545;124545;Posta de Salud Rural Estaquilla;10;De Los Lagos;10106;Los Muermos;24;Del Reloncaví;Posta de Salud Rural;Primario;Primario;Municipal;No Autogestionado;NO;No Especialidad;SI;SI;124545
24-548;124548;Posta de Salud Rural Hueque;10;De Los Lagos;10401;Chaitén;24;Del Reloncaví;Posta de Salud Rural;Primario;Primario;Municipal;No Autogestionado;NO;No Especialidad;SI;SI;124548
24-549;124549;Posta de Salud Rural Macal;10;De Los Lagos;10107;Llanquihue;24;Del Reloncaví;Posta de Salud Rural;Primario;Primario;Municipal;No Autogestionado;NO;No Especialidad;SI;SI;124549
24-550;124550;Posta de Salud Rural Casa de Pesca;10;De Los Lagos;10401;Chaitén;24;Del Reloncaví;Posta de Salud Rural;Primario;Primario;Municipal;No Autogestionado;NO;No Especialidad;SI;SI;124550
24-551;124551;Posta de Salud Rural Machil;10;De Los Lagos;10102;Calbuco;24;Del Reloncaví;Posta de Salud Rural;Primario;Primario;Municipal;No Autogestionado;NO;No Especialidad;SI;SI;124551
24-552;124552;Posta de Salud Rural Queullín;10;De Los Lagos;10102;Calbuco;24;Del Reloncaví;Posta de Salud Rural;Primario;Primario;Municipal;No Autogestionado;NO;No Especialidad;SI;SI;124552
24-553;124553;Posta de Salud Rural San Ramón (Calbuco);10;De Los Lagos;10102;Calbuco;24;Del Reloncaví;Posta de Salud Rural;Primario;Primario;Municipal;No Autogestionado;NO;No Especialidad;SI;SI;124553
24-554;124554;Posta de Salud Rural Huayún;10;De Los Lagos;10102;Calbuco;24;Del Reloncaví;Posta de Salud Rural;Primario;Primario;Municipal;No Autogestionado;NO;No Especialidad;SI;SI;124554
24-555;124555;Posta de Salud Rural Llaguepe;10;De Los Lagos;10103;Cochamó;24;Del Reloncaví;Posta de Salud Rural;Primario;Primario;Municipal;No Autogestionado;NO;No Especialidad;SI;SI;124555
24-982;200082;Posta de Salud Rural Chauchil;10;De Los Lagos;10403;Hualaihué;24;Del Reloncaví;Posta de Salud Rural;Primario;Primario;Servicio de Salud;No Autogestionado;NO;No Especialidad;SI;SI;200082
24-011;124011;PRAIS (S.S Del Reloncaví);10;De Los Lagos;10101;Puerto Montt;24;Del Reloncaví;0;No Aplica;No Aplica;Servicio de Salud;No Autogestionado;NO;No Especialidad;SI;SI;124011
24-805;124805;SAPU Angelmó;10;De Los Lagos;10101;Puerto Montt;24;Del Reloncaví;0;Primario;Primario;Municipal;No Autogestionado;NO;No Especialidad;SI;SI;124805
24-806;124806;SAPU Antonio Varas;10;De Los Lagos;10101;Puerto Montt;24;Del Reloncaví;0;Primario;Primario;Municipal;No Autogestionado;NO;No Especialidad;SI;SI;124806
24-810;124810;SAR Puerto Varas;10;De Los Lagos;10109;Puerto Varas;24;Del Reloncaví;0;Primario;Primario;Municipal;No Autogestionado;NO;No Especialidad;SI;SI;124810
24-881;124881;SAPU Padre Hurtado;10;De Los Lagos;10101;Puerto Montt;24;Del Reloncaví;0;Primario;Primario;Municipal;No Autogestionado;NO;No Especialidad;SI;SI;124881
24-895;124895;SAPU Alerce;10;De Los Lagos;10101;Puerto Montt;24;Del Reloncaví;0;Primario;Primario;Municipal;No Autogestionado;NO;No Especialidad;SI;SI;124895
24-907;200440;Centro Comunitario de Salud Familiar Alerce Norte;10;De Los Lagos;10101;Puerto Montt;24;Del Reloncaví;0;Primario;Primario;Municipal;No Autogestionado;NO;;;SI;200440
24-903;200280;Laboratorio Clínico DESAM Puerto Montt;10;De Los Lagos;10101;Puerto Montt;24;Del Reloncaví;Laboratorio Clínico o Dental;Primario;Primario;Municipal;No Autogestionado;NO;;;SI;200280
24-909;200536;Centro de Especialidades Odontológicas;10;De Los Lagos;10101;Puerto Montt;24;Del Reloncaví;Consultorio General Urbano;Primario;Primario;Municipal;No Autogestionado;NO;;;SI;200536
02-701;102701;Centro Comunitario de Salud Familiar Cerro Esmeralda;1;De Tarapacá;01101;Iquique;2;Iquique;0;Primario;Primario;Municipal;No Autogestionado;NO;No Especialidad;SI;SI;102701
02-705;102705;Centro Comunitario de Salud Familiar El Boro;1;De Tarapacá;01107;Alto Hospicio;2;Iquique;0;Primario;Primario;Municipal;No Autogestionado;NO;No Especialidad;SI;SI;102705
02-905;200335;Centro Comunitario de Salud Familiar La Tortuga;1;De Tarapacá;01107;Alto Hospicio;2;Iquique;0;Primario;Primario;Municipal;No Autogestionado;NO;No Especialidad;SI;SI;200335
02-012;102012;Clínica Dental Móvil Simple. Pat. RW6740 (Iquique);1;De Tarapacá;01101;Iquique;2;Iquique;Clínica Dental Móvil;Primario;Primario;Servicio de Salud;No Autogestionado;NO;No Especialidad;SI;SI;102012
