14-821;114821;SAPU Cardenal Silva Henríquez de Puente Alto;13;Metropolitana de Santiago;13201;Puente Alto;14;M. Sur Oriente;0;Primario;Primario;Municipal;No Autogestionado;NO;No Especialidad;SI;SI;114821
14-822;114822;SAR Padre Manuel Villaseca;13;Metropolitana de Santiago;13201;Puente Alto;14;M. Sur Oriente;0;Primario;Primario;Municipal;No Autogestionado;NO;No Especialidad;SI;SI;114822
14-824;114824;SAPU Santa Amalia;13;Metropolitana de Santiago;13110;La Florida;14;M. Sur Oriente;0;Primario;Primario;Municipal;No Autogestionado;NO;No Especialidad;SI;SI;114824
14-825;114825;SAPU Granja Sur;13;Metropolitana de Santiago;13111;La Granja;14;M. Sur Oriente;0;Primario;Primario;Municipal;No Autogestionado;NO;No Especialidad;SI;SI;114825
14-826;114826;SAPU Karol Wojtyla;13;Metropolitana de Santiago;13201;Puente Alto;14;M. Sur Oriente;0;Primario;Primario;Municipal;No Autogestionado;NO;No Especialidad;SI;SI;114826
14-828;114828;SAPU Poetisa Gabriela Mistral;13;Metropolitana de Santiago;13131;San Ramón;14;M. Sur Oriente;0;Primario;Primario;Municipal;No Autogestionado;NO;No Especialidad;SI;SI;114828
14-831;114831;SAPU La Florida;13;Metropolitana de Santiago;13110;La Florida;14;M. Sur Oriente;0;Primario;Primario;Municipal;No Autogestionado;NO;No Especialidad;SI;SI;114831
14-050;114050;Hospital de Campaña Rusia (Puente Alto);13;Metropolitana de Santiago;13201;Puente Alto;14;M. Sur Oriente;0;Secundario;Terciario;Servicio de Salud;No Autogestionado;NO;Especialidad;NO;NO;114050
26-700;126700;Centro Comunitario de Salud Familiar Dr. Mateo Bencur;12;De Magallanes y de la Antártica Chilena;12101;Punta Arenas;26;Magallanes;0;Primario;Primario;Municipal;No Autogestionado;NO;No Especialidad;SI;SI;126700
26-701;126701;Centro Comunitario de Salud Familiar Río Seco;12;De Magallanes y de la Antártica Chilena;12101;Punta Arenas;26;Magallanes;0;Primario;Primario;Municipal;No Autogestionado;NO;No Especialidad;SI;SI;126701
26-704;126704;Hospital Comunitario Cristina Calderón de Puerto Williams;12;De Magallanes y de la Antártica Chilena;12201;Cabo de Hornos;26;Magallanes;Establecimiento Baja Complejidad;Primario;Terciario;Servicio de Salud;No Autogestionado;SI;No Especialidad;SI;SI;126704
26-902;200311;Centro Comunitario de Salud Familiar Dr. Juan Damianovic;12;De Magallanes y de la Antártica Chilena;12101;Punta Arenas;26;Magallanes;0;Primario;Primario;Municipal;Autogestionado;NO;Atención de Especialidad;SI;SI;200311
26-215;126215;Clínica Sombrero;12;De Magallanes y de la Antártica Chilena;12302;Primavera;12;M. Oriente;Centro de Salud;No Aplica;No Aplica;Privado;No Autogestionado;NO;No Especialidad;SI;SI;126215
26-216;126216;Clínica Harris;12;De Magallanes y de la Antártica Chilena;12201;Cabo de Hornos;12;M. Oriente;Centro de Salud;No Aplica;No Aplica;Público No perteneciente al SNSS;No Autogestionado;NO;No Especialidad;SI;SI;126216
26-300;126300;Centro de Salud Familiar Dr. Mateo Bencur;12;De Magallanes y de la Antártica Chilena;12101;Punta Arenas;26;Magallanes;Consultorio General Urbano;Primario;Primario;Municipal;No Autogestionado;NO;No Especialidad;SI;SI;126300
26-301;126301;Centro de Salud Familiar Dr. Juan Damianovic;12;De Magallanes y de la Antártica Chilena;12101;Punta Arenas;26;Magallanes;Consultorio General Urbano;Primario;Primario;Municipal;No Autogestionado;NO;No Especialidad;SI;SI;126301
26-302;126302;Centro de Salud Familiar 18 Septiembre;12;De Magallanes y de la Antártica Chilena;12101;Punta Arenas;26;Magallanes;Consultorio General Urbano;Primario;Primario;Municipal;No Autogestionado;NO;No Especialidad;SI;SI;126302
26-303;126303;Centro de Salud Familiar Dr. Thomas Fenton;12;De Magallanes y de la Antártica Chilena;12101;Punta Arenas;26;Magallanes;Consultorio General Urbano;Primario;Primario;Municipal;No Autogestionado;NO;No Especialidad;SI;SI;126303
26-304;126304;Centro de Salud Familiar Carlos Ibáñez;12;De Magallanes y de la Antártica Chilena;12101;Punta Arenas;26;Magallanes;Consultorio General Urbano;Primario;Primario;Municipal;No Autogestionado;NO;No Especialidad;SI;SI;126304
26-305;126305;Centro de Salud Familiar Natales;12;De Magallanes y de la Antártica Chilena;12401;Natales;26;Magallanes;Consultorio General Urbano;Primario;Primario;Municipal;No Autogestionado;NO;No Especialidad;SI;SI;126305
26-606;126606;COSAM Punta Arenas;12;De Magallanes y de la Antártica Chilena;12101;Punta Arenas;26;Magallanes;0;Secundario;Secundario;Municipal;No Autogestionado;NO;No Especialidad;SI;SI;126606
26-010;126010;Actividades gestionadas por la Dirección del Servicio para apoyo de la Red (S.S de Magallanes);12;De Magallanes y de la Antártica Chilena;12101;Punta Arenas;26;Magallanes;Dirección Servicio de Salud;No Aplica;No Aplica;Servicio de Salud;No Autogestionado;NO;No Especialidad;SI;SI;126010
26-100;126100;Hospital Clínico de Magallanes Dr. Lautaro Navarro Avaria;12;De Magallanes y de la Antártica Chilena;12101;Punta Arenas;26;Magallanes;Establecimiento Alta Complejidad;Secundario;Terciario;Servicio de Salud;No Autogestionado;SI;No Especialidad;SI;SI;126100
26-102;126102;Hospital Dr. Marco Antonio Chamorro ( Porvenir);12;De Magallanes y de la Antártica Chilena;12301;Porvenir;26;Magallanes;Establecimiento Baja Complejidad;Primario;Terciario;Servicio de Salud;No Autogestionado;SI;No Especialidad;SI;SI;126102
26-101;126101;Hospital Dr. Augusto Essmann Burgos ( Natales);12;De Magallanes y de la Antártica Chilena;12401;Natales;26;Magallanes;Establecimiento Mediana Complejidad;Secundario;Terciario;Servicio de Salud;No Autogestionado;SI;No Especialidad;SI;SI;126101
26-204;126204;Hospital Naval (Puerto Williams) (D);12;De Magallanes y de la Antártica Chilena;12201;Cabo de Hornos;26;Magallanes;Establecimiento Mediana Complejidad;Secundario;Terciario;Otra Institución;No Autogestionado;SI;No Especialidad;SI;SI;126204
26-228;126228;Laboratorio Clínico Corporación Municipal Punta Arenas;12;De Magallanes y de la Antártica Chilena;12101;Punta Arenas;26;Magallanes;Laboratorio Clínico o Dental;Primario;Primario;Municipal;No Autogestionado;NO;No Especialidad;SI;SI;126228
26-090;126090;Oficina Sanitaria Dorotea;12;De Magallanes y de la Antártica Chilena;12401;Natales;26;Magallanes;Oficina Sanitaria;No Aplica;No Aplica;Autoridad Sanitaria;No Autogestionado;NO;No Especialidad;SI;SI;126090
26-400;126400;Posta de Salud Rural Cerro Castillo (Torres del Paine);12;De Magallanes y de la Antártica Chilena;12402;Torres del Paine;26;Magallanes;Posta de Salud Rural;Primario;Primario;Municipal;No Autogestionado;NO;No Especialidad;SI;SI;126400
26-402;126402;Posta de Salud Rural Río Verde;12;De Magallanes y de la Antártica Chilena;12103;Río Verde;26;Magallanes;Posta de Salud Rural;Primario;Primario;Municipal;No Autogestionado;NO;No Especialidad;SI;SI;126402
26-403;126403;Posta de Salud Rural Tehuelches;12;De Magallanes y de la Antártica Chilena;12102;Laguna Blanca;26;Magallanes;Posta de Salud Rural;Primario;Primario;Municipal;No Autogestionado;NO;No Especialidad;SI;SI;126403
26-404;126404;Posta de Salud Rural Punta Delgada;12;De Magallanes y de la Antártica Chilena;12104;San Gregorio;26;Magallanes;Posta de Salud Rural;Primario;Primario;Municipal;No Autogestionado;NO;No Especialidad;SI;SI;126404
26-410;126410;Posta de Salud Rural Puerto Edén;12;De Magallanes y de la Antártica Chilena;12401;Natales;26;Magallanes;Posta de Salud Rural;Primario;Primario;Municipal;No Autogestionado;NO;No Especialidad;SI;SI;126410
26-412;126412;Posta de Salud Rural Cameron;12;De Magallanes y de la Antártica Chilena;12303;Timaukel;26;Magallanes;Posta de Salud Rural;Primario;Primario;Municipal;No Autogestionado;NO;No Especialidad;SI;SI;126412
26-413;126413;Posta de Salud Rural Dorotea;12;De Magallanes y de la Antártica Chilena;12401;Natales;26;Magallanes;Posta de Salud Rural;Primario;Primario;Municipal;No Autogestionado;NO;No Especialidad;SI;SI;126413
26-414;126414;Posta de Salud Rural Agua Fresca;12;De Magallanes y de la Antártica Chilena;12101;Punta Arenas;26;Magallanes;Posta de Salud Rural;Primario;Primario;Municipal;No Autogestionado;NO;No Especialidad;SI;SI;126414
26-011;126011;PRAIS (S.S Magallanes);12;De Magallanes y de la Antártica Chilena;12101;Punta Arenas;26;Magallanes;0;No Aplica;No Aplica;Servicio de Salud;No Autogestionado;NO;No Especialidad;SI;SI;126011
26-800;126800;SAPU Dr. Mateo Bencur;12;De Magallanes y de la Antártica Chilena;12101;Punta Arenas;26;Magallanes;0;Primario;Primario;Municipal;No Autogestionado;NO;No Especialidad;SI;SI;126800
26-801;126801;SAPU Dr. Juan Damianovic;12;De Magallanes y de la Antártica Chilena;12101;Punta Arenas;26;Magallanes;0;Primario;Primario;Municipal;No Autogestionado;NO;No Especialidad;SI;SI;126801
26-095;126095;Vacunatorio SEREMI de Salud Magallanes;12;De Magallanes y de la Antártica Chilena;12101;Punta Arenas;26;Magallanes;Vacunatorio;Primario;Primario;Autoridad Sanitaria;No Autogestionado;NO;No Especialidad;SI;SI;126095
09-900;200554;Centro Comunitario de Salud Familiar Las Enredaderas;13;Metropolitana de Santiago;13108;Independencia;9;M. Norte;0;Primario;Primario;Municipal;No Autogestionado;NO;;;SI;200554
10-927;200385;Centro Comunitario de Salud Familiar San Vicente de Naltagua;13;Metropolitana de Santiago;13603;Isla de Maipo;10;M. Occidente;0;Primario;Primario;Municipal;No Autogestionado;NO;;;SI;200385
10-928;200454;Centro Comunitario de Salud Familiar Lo Chacón;13;Metropolitana de Santiago;13602;El Monte;10;M. Occidente;0;Primario;Primario;Municipal;No Autogestionado;NO;;;SI;200454
12-923;200389;Centro Comunitario de Salud Familiar Amapolas;13;Metropolitana de Santiago;13120;Ñuñoa;12;M. Oriente;0;Primario;Primario;Municipal;No Autogestionado;NO;;;SI;200389
;200556;Hospital Digital;13;Metropolitana de Santiago;13101;Santiago;0;M. Sur;Hospital Digital;Secundario;Secundario;0;No Autogestionado;NO;;;SI;200556
14-906;200468;COSAM CEIF Puente Alto Norte;13;Metropolitana de Santiago;13201;Puente Alto;14;M. Sur Oriente;0;Secundario;Secundario;Municipal;No Autogestionado;NO;;;SI;200468
14-907;200475;Centro Comunitario de Salud Familiar Las Lomas;13;Metropolitana de Santiago;13110;La Florida;14;M. Sur Oriente;0;Primario;Primario;Municipal;No Autogestionado;NO;;;SI;200475
17-701;117701;Centro Comunitario de Salud Familiar Padre Hurtado;16;De Ñuble;16101;Chillán ;17;Ñuble;0;Primario;Primario;Servicio de Salud;No Autogestionado;NO;No Especialidad;SI;SI;117701
17-702;117702;Centro Comunitario de Salud Familiar El Roble;16;De Ñuble;16101;Chillán ;17;Ñuble;0;Primario;Primario;Municipal;No Autogestionado;NO;No Especialidad;SI;SI;117702
17-706;117706;Centro Comunitario de Salud Familiar El Casino;16;De Ñuble;16107;Quillón;17;Ñuble;0;Primario;Primario;Municipal;No Autogestionado;NO;No Especialidad;SI;SI;117706
17-729;117729;Centro Comunitario de Salud Familiar Valle Hondo;16;De Ñuble;16301;San Carlos;17;Ñuble;0;Primario;Primario;Municipal;No Autogestionado;NO;No Especialidad;SI;SI;117729
17-799;117799;Centro Comunitario de Salud Familiar Los Alpes;16;De Ñuble;16101;Chillán ;17;Ñuble;0;Primario;Primario;Municipal;No Autogestionado;NO;No Especialidad;SI;SI;117799
17-902;200261;Centro Comunitario de Salud Familiar Doña Isabel;16;De Ñuble;16101;Chillán ;17;Ñuble;0;Primario;Primario;Municipal;No Autogestionado;NO;No Especialidad;SI;SI;200261
17-012;117012;Clínica Dental Móvil Triple. Pat. PW4105 (Chillán);16;De Ñuble;16101;Chillán ;17;Ñuble;Clínica Dental Móvil;Primario;Primario;Servicio de Salud;No Autogestionado;NO;No Especialidad;SI;SI;117012
17-455;117455;Consultorio General Rural de Pueblo Seco;16;De Ñuble;16108;San Ignacio;17;Ñuble;Consultorio General Rural;Primario;Primario;Municipal;No Autogestionado;NO;No Especialidad;SI;SI;117455
17-301;117301;Centro de Salud Familiar Violeta Parra;16;De Ñuble;16101;Chillán ;17;Ñuble;Consultorio General Urbano;Primario;Primario;Servicio de Salud;No Autogestionado;NO;No Especialidad;SI;SI;117301
17-302;117302;Centro de Salud Familiar San Ramón Nonato;16;De Ñuble;16101;Chillán ;17;Ñuble;Consultorio General Urbano;Primario;Primario;Municipal;No Autogestionado;NO;No Especialidad;SI;SI;117302
17-303;117303;Centro de Salud Familiar Ultraestación Dr. Raúl San Martín González;16;De Ñuble;16101;Chillán ;17;Ñuble;Consultorio General Urbano;Primario;Primario;Municipal;No Autogestionado;NO;No Especialidad;SI;SI;117303
17-304;117304;Centro de Salud Familiar Isabel Riquelme;16;De Ñuble;16101;Chillán ;17;Ñuble;Consultorio General Urbano;Primario;Primario;Municipal;No Autogestionado;NO;No Especialidad;SI;SI;117304
17-305;117305;Centro de Salud Familiar Portezuelo;16;De Ñuble;16205;Portezuelo;17;Ñuble;Consultorio General Rural;Primario;Primario;Municipal;No Autogestionado;NO;No Especialidad;SI;SI;117305
17-306;117306;Centro de Salud Familiar Quillón;16;De Ñuble;16107;Quillón;17;Ñuble;Consultorio General Rural;Primario;Primario;Municipal;No Autogestionado;NO;No Especialidad;SI;SI;117306
17-307;117307;Centro de Salud Familiar Cobquecura;16;De Ñuble;16202;Cobquecura;17;Ñuble;Consultorio General Rural;Primario;Primario;Municipal;No Autogestionado;NO;No Especialidad;SI;SI;117307
17-308;117308;Centro de Salud Familiar San Ignacio;16;De Ñuble;16108;San Ignacio;17;Ñuble;Consultorio General Rural;Primario;Primario;Municipal;No Autogestionado;NO;No Especialidad;SI;SI;117308
17-309;117309;Centro de Salud Familiar San Fabián;16;De Ñuble;16304;San Fabián;17;Ñuble;Consultorio General Rural;Primario;Primario;Municipal;No Autogestionado;NO;No Especialidad;SI;SI;117309
17-310;117310;Centro de Salud Familiar Pemuco;16;De Ñuble;16105;Pemuco;17;Ñuble;Consultorio General Rural;Primario;Primario;Municipal;No Autogestionado;NO;No Especialidad;SI;SI;117310
17-311;117311;Centro de Salud Familiar Dr. José Duran Trujillo;16;De Ñuble;16301;San Carlos;17;Ñuble;Consultorio General Urbano;Primario;Primario;Municipal;No Autogestionado;NO;No Especialidad;SI;SI;117311
17-312;117312;Centro de Salud Familiar San Nicolás;16;De Ñuble;16305;San Nicolás;17;Ñuble;Consultorio General Rural;Primario;Primario;Municipal;No Autogestionado;NO;No Especialidad;SI;SI;117312
17-313;117313;Centro de Salud Familiar Ñiquén;16;De Ñuble;16303;Ñiquén;17;Ñuble;Consultorio General Rural;Primario;Primario;Municipal;No Autogestionado;NO;No Especialidad;SI;SI;117313
17-314;117314;Centro de Salud Familiar Dr. David Benavente de Ninhue;16;De Ñuble;16204;Ninhue;17;Ñuble;Consultorio General Rural;Primario;Primario;Municipal;No Autogestionado;NO;No Especialidad;SI;SI;117314
17-315;117315;Centro de Salud Familiar Campanario;16;De Ñuble;16109;Yungay;17;Ñuble;Consultorio General Rural;Primario;Primario;Municipal;No Autogestionado;NO;No Especialidad;SI;SI;117315
17-316;117316;Centro de Salud Familiar Ñipas;16;De Ñuble;16206;Ránquil;17;Ñuble;Consultorio General Rural;Primario;Primario;Municipal;No Autogestionado;NO;No Especialidad;SI;SI;117316
17-317;117317;Centro de Salud Familiar Pinto;16;De Ñuble;16106;Pinto;17;Ñuble;Consultorio General Rural;Primario;Primario;Municipal;No Autogestionado;NO;No Especialidad;SI;SI;117317
17-318;117318;Centro de Salud Familiar Coihueco;16;De Ñuble;16302;Coihueco;17;Ñuble;Consultorio General Rural;Primario;Primario;Municipal;No Autogestionado;NO;No Especialidad;SI;SI;117318
17-319;117319;Centro de Salud Familiar Quiriquina;16;De Ñuble;16108;San Ignacio;17;Ñuble;Consultorio General Rural;Primario;Primario;Municipal;No Autogestionado;NO;No Especialidad;SI;SI;117319
17-322;117322;Centro de Salud Familiar Quinchamalí;16;De Ñuble;16101;Chillán ;17;Ñuble;Consultorio General Rural;Primario;Primario;Municipal;No Autogestionado;NO;No Especialidad;SI;SI;117322
17-324;117324;Centro de Salud Familiar Los Volcanes;16;De Ñuble;16101;Chillán ;17;Ñuble;Consultorio General Urbano;Primario;Primario;Municipal;No Autogestionado;NO;No Especialidad;SI;SI;117324
17-325;117325;Centro de Salud Familiar Luis Montecinos;16;De Ñuble;16302;Coihueco;17;Ñuble;Consultorio General Rural;Primario;Primario;Municipal;No Autogestionado;NO;No Especialidad;SI;SI;117325
17-326;117326;Centro de Salud Familiar Santa Clara;16;De Ñuble;16102;Bulnes;17;Ñuble;Consultorio General Rural;Primario;Primario;Municipal;No Autogestionado;NO;No Especialidad;SI;SI;117326
17-327;117327;Centro de Salud Familiar Treguaco;16;De Ñuble;16207;Treguaco;17;Ñuble;Consultorio General Rural;Primario;Primario;Municipal;No Autogestionado;NO;No Especialidad;SI;SI;117327
17-328;117328;Centro de Salud Familiar Dr. Federico Puga;16;De Ñuble;16103;Chillán Viejo;17;Ñuble;Consultorio General Urbano;Primario;Primario;Municipal;No Autogestionado;NO;No Especialidad;SI;SI;117328
17-329;117329;Centro de Salud Familiar Teresa Baldechi;16;De Ñuble;16301;San Carlos;17;Ñuble;Consultorio General Urbano;Primario;Primario;Municipal;No Autogestionado;NO;No Especialidad;SI;SI;117329
17-330;117330;Centro de Salud Familiar Sol de Oriente;16;De Ñuble;16101;Chillán ;17;Ñuble;Consultorio General Urbano;Primario;Primario;Municipal;No Autogestionado;NO;No Especialidad;SI;SI;117330
17-331;117331;Centro de Salud Familiar Dra. Michelle Bachelet Jeria;16;De Ñuble;16103;Chillán Viejo;17;Ñuble;Consultorio General Urbano;Primario;Primario;Municipal;No Autogestionado;NO;No Especialidad;SI;SI;117331
17-601;117601;COSAM Chillán;16;De Ñuble;16101;Chillán ;17;Ñuble;0;Secundario;Secundario;Municipal;No Autogestionado;NO;No Especialidad;SI;SI;117601
17-602;117602;COSAM San Carlos;16;De Ñuble;16301;San Carlos;17;Ñuble;0;Secundario;Secundario;Servicio de Salud;No Autogestionado;NO;No Especialidad;SI;SI;117602
17-010;117010;Actividades gestionadas por la Dirección del Servicio para apoyo de la Red (S.S de Ñuble);16;De Ñuble;16101;Chillán ;17;Ñuble;Dirección Servicio de Salud;No Aplica;No Aplica;Servicio de Salud;No Autogestionado;NO;No Especialidad;SI;SI;117010
17-101;117101;Hospital Clínico Herminda Martín (Chillán);16;De Ñuble;16101;Chillán ;17;Ñuble;Establecimiento Alta Complejidad;Secundario;Terciario;Servicio de Salud;No Autogestionado;SI;No Especialidad;SI;SI;117101
17-102;117102;Hospital de San Carlos;16;De Ñuble;16301;San Carlos;17;Ñuble;Establecimiento Alta Complejidad;Secundario;Terciario;Servicio de Salud;No Autogestionado;SI;No Especialidad;SI;SI;117102
17-103;117103;Hospital Comunitario de Salud Familiar de Bulnes;16;De Ñuble;16102;Bulnes;17;Ñuble;Establecimiento Baja Complejidad;Primario;Terciario;Servicio de Salud;No Autogestionado;SI;No Especialidad;SI;SI;117103
17-104;117104;Hospital Comunitario de Salud Familiar Pedro Morales Campos (Yungay);16;De Ñuble;16109;Yungay;17;Ñuble;Establecimiento Baja Complejidad;Primario;Terciario;Servicio de Salud;No Autogestionado;SI;No Especialidad;SI;SI;117104
17-106;117106;Hospital Comunitario de Salud Familiar de Quirihue;16;De Ñuble;16201;Quirihue;17;Ñuble;Establecimiento Baja Complejidad;Primario;Terciario;Servicio de Salud;No Autogestionado;SI;No Especialidad;SI;SI;117106
17-107;117107;Hospital Comunitario de Salud Familiar de El Carmen;16;De Ñuble;16104;El Carmen;17;Ñuble;Establecimiento Baja Complejidad;Primario;Terciario;Servicio de Salud;No Autogestionado;SI;No Especialidad;SI;SI;117107
17-108;117108;Hospital Comunitario de Salud Familiar Dr. Eduardo Contreras Trabucco de Coelemu;16;De Ñuble;16203;Coelemu;17;Ñuble;Establecimiento Baja Complejidad;Primario;Terciario;Servicio de Salud;No Autogestionado;SI;No Especialidad;SI;SI;117108
17-401;117401;Posta de Salud Rural Talquipén;16;De Ñuble;16302;Coihueco;17;Ñuble;Posta de Salud Rural;Primario;Primario;Municipal;No Autogestionado;NO;No Especialidad;SI;SI;117401
17-403;117403;Posta de Salud Rural Bustamante;16;De Ñuble;16302;Coihueco;17;Ñuble;Posta de Salud Rural;Primario;Primario;Municipal;No Autogestionado;NO;No Especialidad;SI;SI;117403
17-405;117405;Posta de Salud Rural Capilla Cato;16;De Ñuble;16101;Chillán ;17;Ñuble;Posta de Salud Rural;Primario;Primario;Municipal;No Autogestionado;NO;No Especialidad;SI;SI;117405
17-406;117406;Posta de Salud Rural Minas del Prado;16;De Ñuble;16302;Coihueco;17;Ñuble;Posta de Salud Rural;Primario;Primario;Municipal;No Autogestionado;NO;No Especialidad;SI;SI;117406
17-407;117407;Posta de Salud Rural Tanilvoro;16;De Ñuble;16302;Coihueco;17;Ñuble;Posta de Salud Rural;Primario;Primario;Municipal;No Autogestionado;NO;No Especialidad;SI;SI;117407
17-409;117409;Posta de Salud Rural Recinto;16;De Ñuble;16106;Pinto;17;Ñuble;Posta de Salud Rural;Primario;Primario;Municipal;No Autogestionado;NO;No Especialidad;SI;SI;117409
17-410;117410;Posta de Salud Rural Huape;16;De Ñuble;16101;Chillán ;17;Ñuble;Posta de Salud Rural;Primario;Primario;Municipal;No Autogestionado;NO;No Especialidad;SI;SI;117410
17-413;117413;Posta de Salud Rural Rucapequén;16;De Ñuble;16103;Chillán Viejo;17;Ñuble;Posta de Salud Rural;Primario;Primario;Municipal;No Autogestionado;NO;No Especialidad;SI;SI;117413
17-414;117414;Posta de Salud Rural Nebuco;16;De Ñuble;16103;Chillán Viejo;17;Ñuble;Posta de Salud Rural;Primario;Primario;Municipal;No Autogestionado;NO;No Especialidad;SI;SI;117414
17-415;117415;Centro Comunitario de Salud Familiar Cachapoal;16;De Ñuble;16301;San Carlos;17;Ñuble;0;Primario;Primario;Municipal;No Autogestionado;NO;No Especialidad;SI;SI;117415
17-416;117416;Posta de Salud Rural Rivera de Ñuble;16;De Ñuble;16301;San Carlos;17;Ñuble;Posta de Salud Rural;Primario;Primario;Municipal;No Autogestionado;NO;No Especialidad;SI;SI;117416
17-418;117418;Centro Comunitario de Salud Familiar Chacay;16;De Ñuble;16303;Ñiquén;17;Ñuble;0;Primario;Primario;Municipal;No Autogestionado;NO;No Especialidad;SI;SI;117418
17-419;117419;Posta de Salud Rural Ñiquén;16;De Ñuble;16303;Ñiquén;17;Ñuble;Posta de Salud Rural;Primario;Primario;Municipal;No Autogestionado;NO;No Especialidad;SI;SI;117419
17-421;117421;Posta de Salud Rural Torrecillas;16;De Ñuble;16301;San Carlos;17;Ñuble;Posta de Salud Rural;Primario;Primario;Municipal;No Autogestionado;NO;No Especialidad;SI;SI;117421
17-422;117422;Posta de Salud Rural La Gloria;16;De Ñuble;16303;Ñiquén;17;Ñuble;Posta de Salud Rural;Primario;Primario;Municipal;No Autogestionado;NO;No Especialidad;SI;SI;117422
17-423;117423;Posta de Salud Rural Monte Blanco;16;De Ñuble;16301;San Carlos;17;Ñuble;Posta de Salud Rural;Primario;Primario;Municipal;No Autogestionado;NO;No Especialidad;SI;SI;117423
17-425;117425;Posta de Salud Rural Las Raíces;16;De Ñuble;16102;Bulnes;17;Ñuble;Posta de Salud Rural;Primario;Primario;Municipal;No Autogestionado;NO;No Especialidad;SI;SI;117425
17-426;117426;Centro Comunitario de Salud Familiar Tres Esquinas;16;De Ñuble;16102;Bulnes;17;Ñuble;0;Primario;Primario;Municipal;No Autogestionado;NO;No Especialidad;SI;SI;117426
17-427;117427;Posta de Salud Rural Nueva Aldea;16;De Ñuble;16206;Ránquil;17;Ñuble;Posta de Salud Rural;Primario;Primario;Municipal;No Autogestionado;NO;No Especialidad;SI;SI;117427
17-430;117430;Posta de Salud Rural Cartago;16;De Ñuble;16105;Pemuco;17;Ñuble;Posta de Salud Rural;Primario;Primario;Municipal;No Autogestionado;NO;No Especialidad;SI;SI;117430
17-431;117431;Posta de Salud Rural Gral. Cruz;16;De Ñuble;16105;Pemuco;17;Ñuble;Posta de Salud Rural;Primario;Primario;Municipal;No Autogestionado;NO;No Especialidad;SI;SI;117431
17-433;117433;Posta de Salud Rural El Sauce (Ninhue);16;De Ñuble;16204;Ninhue;17;Ñuble;Posta de Salud Rural;Primario;Primario;Municipal;No Autogestionado;NO;No Especialidad;SI;SI;117433
17-434;117434;Posta de Salud Rural Los Remates;16;De Ñuble;16201;Quirihue;17;Ñuble;Posta de Salud Rural;Primario;Primario;Municipal;No Autogestionado;NO;No Especialidad;SI;SI;117434
17-435;117435;Posta de Salud Rural Trehualemu;16;De Ñuble;16104;El Carmen;17;Ñuble;Posta de Salud Rural;Primario;Primario;Municipal;No Autogestionado;NO;No Especialidad;SI;SI;117435
17-436;117436;Posta de Salud Rural Pedregal de Zapallar;16;De Ñuble;16104;El Carmen;17;Ñuble;Posta de Salud Rural;Primario;Primario;Municipal;No Autogestionado;NO;No Especialidad;SI;SI;117436
17-437;117437;Posta de Salud Rural San Vicente (El Carmen);16;De Ñuble;16104;El Carmen;17;Ñuble;Posta de Salud Rural;Primario;Primario;Municipal;No Autogestionado;NO;No Especialidad;SI;SI;117437
17-438;117438;Posta de Salud Rural Huemul;16;De Ñuble;16104;El Carmen;17;Ñuble;Posta de Salud Rural;Primario;Primario;Municipal;No Autogestionado;NO;No Especialidad;SI;SI;117438
17-439;117439;Posta de Salud Rural Ranguelmo;16;De Ñuble;16203;Coelemu;17;Ñuble;Posta de Salud Rural;Primario;Primario;Municipal;No Autogestionado;NO;No Especialidad;SI;SI;117439
17-442;117442;Posta de Salud Rural Guarilihue;16;De Ñuble;16203;Coelemu;17;Ñuble;Posta de Salud Rural;Primario;Primario;Municipal;No Autogestionado;NO;No Especialidad;SI;SI;117442
17-443;117443;Posta de Salud Rural Boca Itata;16;De Ñuble;16207;Treguaco;17;Ñuble;Posta de Salud Rural;Primario;Primario;Municipal;No Autogestionado;NO;No Especialidad;SI;SI;117443
17-444;117444;Posta de Salud Rural Denecan;16;De Ñuble;16207;Treguaco;17;Ñuble;Posta de Salud Rural;Primario;Primario;Municipal;No Autogestionado;NO;No Especialidad;SI;SI;117444
17-445;117445;Posta de Salud Rural Vegas de Itata;16;De Ñuble;16203;Coelemu;17;Ñuble;Posta de Salud Rural;Primario;Primario;Municipal;No Autogestionado;NO;No Especialidad;SI;SI;117445
17-446;117446;Posta de Salud Rural Minas de Leuque;16;De Ñuble;16207;Treguaco;17;Ñuble;Posta de Salud Rural;Primario;Primario;Municipal;No Autogestionado;NO;No Especialidad;SI;SI;117446
17-447;117447;Posta de Salud Rural Cucha Cox;16;De Ñuble;16205;Portezuelo;17;Ñuble;Posta de Salud Rural;Primario;Primario;Municipal;No Autogestionado;NO;No Especialidad;SI;SI;117447
17-448;117448;Posta de Salud Rural Liucura Alto;16;De Ñuble;16107;Quillón;17;Ñuble;Posta de Salud Rural;Primario;Primario;Municipal;No Autogestionado;NO;No Especialidad;SI;SI;117448
